{
  "ticker_or_query": "DEMO",
  "market": "A",
  "audit_time": "2026-07-04T20:12:41",
  "windows": [
    "24h",
    "72h",
    "7d",
    "30d",
    "90d"
  ],
  "evidence_status": "PASS",
  "coverage_score": 100,
  "confidence_cap": 8,
  "source_coverage": {
    "official_disclosure": "covered",
    "market_news": "covered",
    "flash_news": "covered",
    "policy_industry": "covered",
    "social_sentiment": "covered",
    "price_volume_anomaly": "covered",
    "collector_errors": "none"
  },
  "time_coverage": {
    "24h": "partial",
    "72h": "partial",
    "7d": "partial",
    "30d": "partial",
    "90d": "partial"
  },
  "material_events": [
    {
      "id": "6d6e151037bb1a08",
      "source": "official_disclosure_demo",
      "title": "官方公告：DEMO 发布回购进展公告，当前无停牌或退市风险提示。",
      "raw": "官方公告：DEMO 发布回购进展公告，当前无停牌或退市风险提示。",
      "event_categories": [
        "delisting_risk",
        "shareholder_change",
        "trading_halt"
      ],
      "reliability": 5,
      "confirmed": true,
      "captured_at": "2026-07-04T20:12:41"
    },
    {
      "id": "ccb7711e85c17309",
      "source": "flash_news_demo",
      "title": "7x24快讯：相关产业政策发布，市场关注龙头公司订单弹性。",
      "raw": "7x24快讯：相关产业政策发布，市场关注龙头公司订单弹性。",
      "event_categories": [
        "industry_policy",
        "major_contract"
      ],
      "reliability": 4,
      "confirmed": true,
      "captured_at": "2026-07-04T20:12:41"
    },
    {
      "id": "a3eda124a1cb2820",
      "source": "price_volume_demo",
      "title": "价格异动：近三日成交量放大，需要与资金流和新闻催化交叉验证。",
      "raw": "价格异动：近三日成交量放大，需要与资金流和新闻催化交叉验证。",
      "event_categories": [
        "trading_anomaly"
      ],
      "reliability": 4,
      "confirmed": true,
      "captured_at": "2026-07-04T20:12:41"
    }
  ],
  "unconfirmed_events": [],
  "conflicts": [],
  "price_volume_anomalies": [
    {
      "type": "text_detected_possible_anomaly",
      "detail": "Captured text contains price/volume/fund-flow anomaly terms.",
      "matched_news": true,
      "risk": "medium"
    }
  ],
  "missing_sources": [],
  "downstream_instructions": [
    "Start final report with evidence_status, coverage_score, and confidence_cap.",
    "Do not exceed confidence_cap.",
    "Discuss material_events before technical or valuation conclusions.",
    "Do not say no major news unless official_disclosure, market_news, and flash_news are covered.",
    "If official_disclosure is missing, avoid strong BUY/SELL language.",
    "If price/volume anomaly is unexplained, mark information-gap risk.",
    "Include a section: 哪些新增信息会推翻当前结论."
  ],
  "items": [
    {
      "id": "6d6e151037bb1a08",
      "source": "official_disclosure_demo",
      "title": "官方公告：DEMO 发布回购进展公告，当前无停牌或退市风险提示。",
      "raw": "官方公告：DEMO 发布回购进展公告，当前无停牌或退市风险提示。",
      "event_categories": [
        "delisting_risk",
        "shareholder_change",
        "trading_halt"
      ],
      "reliability": 5,
      "confirmed": true,
      "captured_at": "2026-07-04T20:12:41"
    },
    {
      "id": "1c8611d581e1d4c3",
      "source": "market_news_demo",
      "title": "市场新闻：DEMO 所属板块出现资金流入，行业景气度讨论升温。",
      "raw": "市场新闻：DEMO 所属板块出现资金流入，行业景气度讨论升温。",
      "event_categories": [],
      "reliability": 4,
      "confirmed": true,
      "captured_at": "2026-07-04T20:12:41"
    },
    {
      "id": "ccb7711e85c17309",
      "source": "flash_news_demo",
      "title": "7x24快讯：相关产业政策发布，市场关注龙头公司订单弹性。",
      "raw": "7x24快讯：相关产业政策发布，市场关注龙头公司订单弹性。",
      "event_categories": [
        "industry_policy",
        "major_contract"
      ],
      "reliability": 4,
      "confirmed": true,
      "captured_at": "2026-07-04T20:12:41"
    },
    {
      "id": "75ca4747cdcc40db",
      "source": "social_sentiment_demo",
      "title": "社媒舆情：投资者讨论热度上升，但未见可确认重大利空。",
      "raw": "社媒舆情：投资者讨论热度上升，但未见可确认重大利空。",
      "event_categories": [],
      "reliability": 2,
      "confirmed": false,
      "captured_at": "2026-07-04T20:12:41"
    },
    {
      "id": "a3eda124a1cb2820",
      "source": "price_volume_demo",
      "title": "价格异动：近三日成交量放大，需要与资金流和新闻催化交叉验证。",
      "raw": "价格异动：近三日成交量放大，需要与资金流和新闻催化交叉验证。",
      "event_categories": [
        "trading_anomaly"
      ],
      "reliability": 4,
      "confirmed": true,
      "captured_at": "2026-07-04T20:12:41"
    }
  ]
}